name,role,location,experience,skills,company,education,total_score,email
Riya Naik,Data Scientist,Mumbai,3,"Python, SQL, Pandas",ABC Corp,B.Tech,85,riyanaikdhure855@gmail.com
Jyoti Rane,Data Analyst,Mumbai,1,"Python, SQL, Excel, Tableau",Startup Labs,B.Com,65,jyorane2006@gmail.com
Aarav Mehta,Data Scientist,Mumbai,4,"Python, ML, Pandas, SQL, Deep Learning",Infosys,B.Tech CSE,88,aarav.mehta01@gmail.com
Neha Kulkarni,Data Analyst,Pune,3,"Python, SQL, Tableau, Power BI, Excel",Accenture,B.Sc Statistics,72,neha.kulkarni.ds@gmail.com
Rahul Verma,Machine Learning Engineer,Bangalore,5,"Python, TensorFlow, NLP, SQL, AWS",Flipkart,M.Tech AI,91,rahul.verma.ml@gmail.com